{
  "accessRights": null,
  "category": null,
  "conformsTo": null,
  "contactPoint": [],
  "created": null,
  "creator": null,
  "description": null,
  "endpointDescription": null,
  "endpointURL": [],
  "hasQualityMeasurement": null,
  "identifier": null,
  "keyword": null,
  "language": null,
  "license": null,
  "modified": null,
  "otherIdentifier": null,
  "publisher": {
    "name": ""
  },
  "qualifiedAttribution": null,
  "rights": null,
  "rightsHolder": null,
  "servesDataset": null,
  "spatial": null,
  "spatialResolutionInMeters": null,
  "temporal": null,
  "temporalResolution": null,
  "theme": null,
  "title": "",
  "wasUsedBy": null
}
